{
  "paper": {
    "id": "2602.03973",
    "arxiv_id": "2602.03973",
    "doi": "10.48550/arXiv.2602.03973",
    "title": "VLS: Steering Pretrained Robot Policies via Vision-Language Models",
    "authors": [
      "Shuo Liu",
      "Ishneet Sukhvinder Singh",
      "Yiqing Xu",
      "Jiafei Duan",
      "Ranjay Krishna"
    ],
    "year": 2026,
    "primary_url": "https://arxiv.org/html/2602.03973v1",
    "source_version": "arXiv v1, submitted 2026-02-03 19:50:16 UTC; sole public revision verified 2026-08-30; versioned PDF SHA-256 8cb3c52f2ca3504b3876bdcef960ba51c69763055aa63fe52eff38b3d3c6ebd3; TeX-source archive SHA-256 9f485671e7c2f34b38100bc7c5b884822af0d534e35b61e88674dd120ec4c2ba. Official project source pinned to Vision-Language-Steering/webpage commit 110c5aa937db24f17fe69af2b28887edaea6d557. Official code inspected at untagged main commit b6e87edc217a2a7682caadba285677fc79eb6f81, committed 2026-03-29; the paper does not bind its reported runs to that post-paper commit."
  },
  "decision_relevance": {
    "tier": "supporting",
    "knobs": [
      "task_reward",
      "human_steering",
      "evaluation",
      "fixed_trainer"
    ],
    "why_admitted": "VLS provides source-located evidence for compiling an observation-language condition into staged differentiable PyTorch reward programs, driving a closed-loop reward-stage machine, and evaluating the resulting steering under OOD perturbations. This is useful precursor and boundary evidence for human-steerable executable reward design. It is not an admissible RL-Sculptor task reward or reference oracle because its rewards score partially denoised action proposals, its mechanisms modify the controller's inference sampler, and it does not revise either allowed artifact from independent evaluation feedback.",
    "not_evidence_for": [
      "An immutable reference trajectory, reference selection policy, playback clock, composition grammar, transition clip, recovery reference, or reference-conditioned policy observation",
      "A task reward consumed by policy training rather than an inference-time action-guidance potential",
      "A fixed controller runtime merely because the base policy parameters remain frozen",
      "An outer metrics-to-oracle or metrics-to-task-reward revision loop",
      "Interactive human feedback, human preference learning, or demonstrated translation of a human correction into either allowed RL-Sculptor artifact",
      "Safe, deterministic, bounded, side-effect-free, or content-addressed execution of generated reward code",
      "Matched inference compute across methods, statistical significance, or cross-seed reliability",
      "An exact end-to-end reproduction identity for the paper's experiments",
      "RL-Sculptor implementation of VLS"
    ]
  },
  "mechanisms": [
    {
      "id": "vls:grounded_keypoint_scaffold",
      "name": "Observation-language grounding into 3D keypoints",
      "description": "A VLM identifies task-relevant objects and regions; SAM produces object masks; DINOv2 supplies dense semantic features; masked pixels are reprojected with depth; and object-centric feature-plus-position point clouds are clustered into task-relevant 3D keypoints P.",
      "tags": [
        "vision_language_grounding",
        "sam",
        "dinov2",
        "rgbd",
        "3d_keypoints"
      ],
      "evidence_ids": [
        "E03"
      ]
    },
    {
      "id": "vls:stagewise_guidance_reward_compiler",
      "name": "Stage-wise differentiable guidance-reward compiler",
      "description": "The VLM decomposes the OOD task into S sequential stages and emits for each stage a scalar PyTorch function R_s over an action proposal and grounded keypoints. The emitted function is differentiated with respect to the action proposal; the VLM remains a non-differentiable off-graph generator.",
      "tags": [
        "programmatic_reward",
        "vlm_generated_code",
        "stage_reward",
        "action_space_gradient",
        "human_steering"
      ],
      "evidence_ids": [
        "E04"
      ]
    },
    {
      "id": "vls:hybrid_denoising_steering",
      "name": "Hybrid gradient and particle denoising steering",
      "description": "At inference, B noisy action proposals receive early pairwise repulsion for diversity, stage-reward gradients during denoising, multiple stochastic inner refinements, and periodic Feynman-Kac multinomial resampling with reward-derived weights. The first final particle is returned as the action chunk.",
      "tags": [
        "inference_time_control",
        "gradient_guidance",
        "rbf_diversity",
        "feynman_kac",
        "particle_resampling",
        "controller_runtime_change"
      ],
      "evidence_ids": [
        "E05",
        "E08"
      ]
    },
    {
      "id": "vls:adaptive_guidance_schedule",
      "name": "Reward-relative adaptive guidance strength",
      "description": "For each stage, VLS compares the current chunk's final-denoising reward with the first chunk's reward and uses a sigmoid-scaled lambda_max to modulate how strongly reward gradients alter later action chunks.",
      "tags": [
        "closed_loop_control",
        "adaptive_guidance",
        "reward_feedback",
        "action_chunk"
      ],
      "evidence_ids": [
        "E06"
      ]
    },
    {
      "id": "vls:schmitt_stage_dispatch",
      "name": "Schmitt-trigger reward-stage dispatch",
      "description": "Two stage-reward thresholds classify execution as advance, maintain, or reinforce. On a switching event, a VLM interprets the outcome and chooses the next stage reward or continued application of the current reward with updated guidance.",
      "tags": [
        "hysteresis",
        "stage_machine",
        "reward_threshold",
        "retry",
        "physical_uncertainty"
      ],
      "evidence_ids": [
        "E07"
      ]
    }
  ],
  "parameters": [
    {
      "name": "inner_refinement_updates",
      "value": {
        "diffusion_policy": 4,
        "flow_matching_policy": 1
      },
      "units": "updates per denoising step",
      "context": "Algorithm 1 sets the MCMC-like inner update count by base-policy family.",
      "evidence_ids": [
        "E08"
      ]
    },
    {
      "name": "libero_pro_suites",
      "value": [
        "Goal",
        "Spatial",
        "Long-10",
        "Object"
      ],
      "units": null,
      "context": "LIBERO-PRO task and position perturbations are applied to four LIBERO suites.",
      "evidence_ids": [
        "E09"
      ]
    },
    {
      "name": "libero_pro_tasks_per_suite",
      "value": 10,
      "units": "tasks per suite",
      "context": "Table I evaluation scope.",
      "evidence_ids": [
        "E09"
      ]
    },
    {
      "name": "libero_pro_episodes_per_task_perturbation",
      "value": 20,
      "units": "episodes",
      "context": "Each task in each suite is evaluated for task and position perturbations.",
      "evidence_ids": [
        "E09"
      ]
    },
    {
      "name": "libero_pro_overall_success_rate",
      "value": {
        "pi_0_5_lerobot": 23.69,
        "pi_0_5_lerobot_plus_vls": 36.81,
        "absolute_gain": 13.12
      },
      "units": "percent / percentage points",
      "context": "Overall mean across task- and position-perturbation suite columns.",
      "evidence_ids": [
        "E09"
      ]
    },
    {
      "name": "libero_pro_group_success_rate",
      "value": {
        "task_base": 23.13,
        "task_vls": 38.5,
        "position_base": 24.25,
        "position_vls": 35.13
      },
      "units": "percent",
      "context": "Task- and position-perturbation averages for the frozen LeRobot pi_0.5 comparison.",
      "evidence_ids": [
        "E09"
      ]
    },
    {
      "name": "calvin_episodes_per_task",
      "value": 600,
      "units": "episodes",
      "context": "Figure 3 comparison of VLS, DynaGuide, ITPS, and the base diffusion policy; error bars are standard deviation.",
      "evidence_ids": [
        "E10"
      ]
    },
    {
      "name": "calvin_vls_success_rate",
      "value": {
        "movable_objects": 94,
        "articulated_parts": 87,
        "reported_relative_gain_movable": 7.4,
        "reported_relative_gain_articulated": 9.6
      },
      "units": "percent and fold gain",
      "context": "Three movable-object tasks and eight articulated-part tasks in Figure 3.",
      "evidence_ids": [
        "E10"
      ]
    },
    {
      "name": "component_ablation_protocol",
      "value": {
        "episodes_per_task": 50,
        "sample_batch_size_K": 10
      },
      "units": "episodes and particles",
      "context": "Full VLS versus removal of gradient guidance, FK resampling, or RBF diversity.",
      "evidence_ids": [
        "E11"
      ]
    },
    {
      "name": "gradient_ablation",
      "value": {
        "without_gradient_success_rate": 17.3,
        "full_vls_success_rate": 88,
        "without_gradient_episode_length": 178.6,
        "full_vls_episode_length": 61
      },
      "units": "percent and environment steps",
      "context": "Figure 4 left; removing the reward gradient produces the largest component drop.",
      "evidence_ids": [
        "E11"
      ]
    },
    {
      "name": "full_vls_k10_inference_time",
      "value": 1189,
      "units": "milliseconds",
      "context": "Figure 4 left at K=10; the paper does not identify the measurement hardware.",
      "evidence_ids": [
        "E11"
      ]
    },
    {
      "name": "particle_count_runtime_sweep",
      "value": {
        "K": [
          1,
          2,
          5,
          10
        ],
        "success_rate_percent": [
          88,
          88,
          90,
          90
        ],
        "episode_length_steps": [
          73.0,
          58.0,
          57.8,
          55.9
        ],
        "inference_time_ms": [
          665,
          799,
          953,
          1239
        ]
      },